ID,ТЕМА,ВОПРОС,АЛЬТЕРНАТИВА А,АЛЬТЕРНАТИВА B,АЛЬТЕРНАТИВА С
246,КОРЬ,Идеальный период для проведения блокирования вакцинации против кори?,До 1 месяца ,До 96 часов,До 72 часов
247,КОРЬ,Кому нельзя делать прививку MMR или тетра?,Пожилые люди,Годовалый ребёнок,Беременные женщины  
248,ЗДОРОВЬЕ СЛУЖАЩИХ И ЕДИНАЯ СИСТЕМА ЗДРАВООХРАНЕНИЯ,Гарантия права на здоровье:,Это не закон,Не является обязательным,Это закон
249,ЗДОРОВЬЕ СЛУЖАЩИХ И ЕДИНАЯ СИСТЕМА ЗДРАВООХРАНЕНИЯ,Аббревиатура - Единой Системы Здравоохранения?,Единая Система Выбора,Информационная Система Болезней Подлежащих Уведомлению,Единая Система Здравоохранения
250,ЗДОРОВЬЕ СЛУЖАЩИХ И ЕДИНАЯ СИСТЕМА ЗДРАВООХРАНЕНИЯ,"В Единой Системе Здравоохранения, включены в право на здоровье:",Работники,У кого есть страховка,Все 
251,ЗДОРОВЬЕ СЛУЖАЩИХ И ЕДИНАЯ СИСТЕМА ЗДРАВООХРАНЕНИЯ,Использование ремней безопасности является обязательным для работы на какой высоте?,1 м,3 м,2 м 
252,ЗДОРОВЬЕ СЛУЖАЩИХ И ЕДИНАЯ СИСТЕМА ЗДРАВООХРАНЕНИЯ,Правильно ли использовать при пожаре с горючими жидкостями:,Вода,CO2,Пена 
253,ЗДОРОВЬЕ СЛУЖАЩИХ И ЕДИНАЯ СИСТЕМА ЗДРАВООХРАНЕНИЯ,Каковы минимальные и максимальные пределы толерантности шума?,85 - 110,80 - 115,85 - 115 
254,ЗМЕЯ,"Что нужно сделать немедленно, в случае несчастного случая со змеей?",Использование жгута,Обработать спиртом,Искать Единую Систему Здравоохранения
255,ЗМЕЯ,Какая из этих ядовитых змей является причиной большинства несчастных случаев в Бразилии?,Гремучая змея,Коралл,Жарарака
256,ЗМЕЯ,Какая из этих змей считается ядовитой?,Анаконда,Удав,Жарарака
257,ЗМЕЯ,Что надо сделать при встрече со змеей?,Пытаться поймать,Сделать селфи,Позвонить в авторитетный орган
258,ЗМЕЯ,"Укусы каких змей ведут к клиническому симптому, известному как «перекошенность лица»?",Гадюка и гремучая змея,Анацонда и гремучая змея,Гремучая змея и коралл
259,СТОЛБНЯК,Рекомендуемая прививка для предотвращения столбняка у взрослых?,MMR,VIP,Двойной взрослый
260,СТОЛБНЯК,"Рекомендуемая прививка для беременных женщин, чтобы предотвратить столбняк новорожденных?",БЦЖ,MMR,Двойной взрослый
261,СТОЛБНЯК,Где может быть найдена бактерия столбняка?,Только в пожилом возрасте,Только на земле,Различных сред
262,СТОЛБНЯК,Как узнать заражены ли вы столбняком?,Дифтерическая пленка,Приступы кашля ,Ригидность мышц
263,СТОЛБНЯК,Какой микроорганизмам вызывает столбняк?,Вирус,Грибки,Бактерия
264,СТОЛБНЯК ,Что является возбудителем столбняка?,Сальмонелла энтерика,Бордетеллы коклюша,Столбнячная палочка
265,ТРАХОМА,Чем вызвано заболевание трахома?,Вирус,Простейшие,Бактерия
266,ТРАХОМА,"Трахома является заболеванием, поражающим?",Периферические нервы,Пищеварительный тракт,Глаза
267,ТРАХОМА,Как лечится от Трахомы?,Болеутоляющее средство,Гипоаллергенный,Антибиотик
268,ТУБЕРКУЛЕЗ,Что такое туберкулез?,Вирусные заболевания,Грибковое заболевание,Бактериальные болезни
269,ТУБЕРКУЛЕЗ,Какая бактерия вызывает туберкулез?,Бледная трепонема,Бордетеллы коклюша,Бацилла Коха
270,ТУБЕРКУЛЕЗ,Какая прививка предотвращает тяжелые формы туберкулеза?,Грипп ,Краснуха,БЦЖ
271,ТУБЕРКУЛЕЗ,Как можно заболеть туберкулезом?,Половые отношения,Через поцелуй и объятье,Кашель или чихание 
272,ТУБЕРКУЛЕЗ,Какой орган наиболее часто поражается туберкулезом?,Печень,Сердце,Лёгкие
273,ТУБЕРКУЛЕЗ,"На какие органы, помимо лёгких,  туберкулез может повлиять?",Только кишечник,Только кости,Все
274,ТУБЕРКУЛЕЗ,Все люди больные туберкулезом могут быть разносчиками болезни?,Да,Только курильщики,Нет
275,ТУБЕРКУЛЕЗ,Какие из них наиболее часто встречающиеся симптомы туберкулеза?,Диарея,Обморок,Кашель
276,ТУБЕРКУЛЕЗ,"После какого периода кашля, может быть заподозрен туберкулез? ",1 неделя,2 недели,3 недели
277,ТУБЕРКУЛЕЗ,"В какую службу здравоохранения следует обратиться, в случае подозрения на туберкулез? ",Специальное обслуживание,Скорая помощь,Медпункт
278,ТУБЕРКУЛЕЗ,Как долго длится лечение туберкулеза?,2 месяца,4 месяца,По крайней мере 6 месяцев
279,ТУБЕРКУЛЕЗ,"Какие обследования нужно пройти, для диагностики туберкулеза легких?",Анализ крови,Анализ мочи,Анализы мокроты
280,ТУБЕРКУЛЕЗ,Сколько стоит лечение для пациентов с туберкулезом?,R$ 20.00,R$ 300.00,Бесплатно в Единой Системе Здравоохранения
281,ТУБЕРКУЛЕЗ,"Что нужно избегать, чтобы предотвратить заболевание туберкулезом?",Объятия,Поцелуи,"Места, которые не проветриваются"
282,ТУБЕРКУЛЕЗ,Кто может предложить препараты для лечения туберкулеза?,Частная сеть,ВОЗ,Единая Система Здравоохранения
283,ТУБЕРКУЛЕЗ,"Нужно ли отделить чашки, столовые приборы, тарелки и другую посуду для больного туберкулезом?",Да,Только тарелки,Нет
284,ТУБЕРКУЛЕЗ,Какое заболевание должно быть исследовано на пациентах больных туберкулезом?,Сифилис,Свинка,ВИЧ
285,ПУНКТ НАДЗОРА ЗАБОЛЕВАНИЙ ПЕРЕДАВАЕМЫХ ЧЕРЕЗ ПРОДУКТЫ ПИТАНИЯ И ВОДУ ,При лечении Острой Диареи рекомендуется:,Начать принимать антибиотики,Принимать лекарства против диареи ,Пить жидкость
286,ПУНКТ НАДЗОРА ЗАБОЛЕВАНИЙ ПЕРЕДАВАЕМЫХ ЧЕРЕЗ ПРОДУКТЫ ПИТАНИЯ И ВОДУ ,Какая из них является частой причиной диареи?,Загрязнённая вода ,Загрязненные продукты питания,Все выше
287,ПУНКТ НАДЗОРА ЗАБОЛЕВАНИЙ ПЕРЕДАВАЕМЫХ ЧЕРЕЗ ПРОДУКТЫ ПИТАНИЯ И ВОДУ ,Какие из этих заболеваний связаны с хронической диареей?,Вирусные заболевания,Сальмонеллез,Целиакия
288,ПУНКТ НАДЗОРА ЗАБОЛЕВАНИЙ ПЕРЕДАВАЕМЫХ ЧЕРЕЗ ПРОДУКТЫ ПИТАНИЯ И ВОДУ ,Чем может быть вызвана диарея?,Бактерии,Вирус,Все выше
289,ПУНКТ НАДЗОРА ЗАБОЛЕВАНИЙ ПЕРЕДАВАЕМЫХ ЧЕРЕЗ ПРОДУКТЫ ПИТАНИЯ И ВОДУ ,"Помимо жидкого стула, какие из этих симптомов могут также возникать во время диареи?",Боль в животе,Тошнота,Все выше
290,ПУНКТ НАДЗОРА ЗАБОЛЕВАНИЙ ПЕРЕДАВАЕМЫХ ЧЕРЕЗ ПРОДУКТЫ ПИТАНИЯ И ВОДУ ,Какая из этих жидкостей является наиболее подходящей для профилактики и лечения обезвоживания?,Овощной бульон,Газированный напиток,Вода и регидратирующий раствор
291,ПУНКТ НАДЗОРА ЗАБОЛЕВАНИЙ ПЕРЕДАВАЕМЫХ ЧЕРЕЗ ПРОДУКТЫ ПИТАНИЯ И ВОДУ ,Как называется диарея с присутствием крови в стуле?,Дифтерия,Хроническая диарея,Дизентерия
292,ПУНКТ НАДЗОРА ЗАБОЛЕВАНИЙ ПЕРЕДАВАЕМЫХ ЧЕРЕЗ ПРОДУКТЫ ПИТАНИЯ И ВОДУ ,"Что является наиболее важным для выбора продуктов питания, которые продаются на улице?",Гигиена,Консервы,Все выше
293,ПУНКТ НАДЗОРА ЗАБОЛЕВАНИЙ ПЕРЕДАВАЕМЫХ ЧЕРЕЗ ПРОДУКТЫ ПИТАНИЯ И ВОДУ ,Какая еда предлагает больший риск для Ботулизма?,Вода,Свежие овощи ,Встроенный
294,ПУНКТ НАДЗОРА ЗАБОЛЕВАНИЙ ПЕРЕДАВАЕМЫХ ЧЕРЕЗ ПРОДУКТЫ ПИТАНИЯ И ВОДУ ,Как предотвратить Ротавирусную диарею?,Гигиена фруктов,Использование репеллентов,Гигиена рук
295,ПУНКТ НАДЗОРА ЗАБОЛЕВАНИЙ ПЕРЕДАВАЕМЫХ ЧЕРЕЗ ПРОДУКТЫ ПИТАНИЯ И ВОДУ ,Какие из этих заболеваний могут передаваться от матери к ребенку во время беременности?,Грипп,Брюшной тиф,Токсоплазмоз
296,ПУНКТ НАДЗОРА ЗАБОЛЕВАНИЙ ПЕРЕДАВАЕМЫХ ЧЕРЕЗ ПРОДУКТЫ ПИТАНИЯ И ВОДУ ,Дети до 2-х лет не могут есть мёд из-за риска приобретения какой болезни?,Коклюш ,Малярия,Ботулизм
297,ВАКЦИНАЦИЯ ПУТЕШЕСТВЕННИКА,"За сколько времени до путешествия, вы должны проверить ваши прививки? ",1 день,1 неделя,4 - 8 недель
298,ВАКЦИНАЦИЯ ПУТЕШЕСТВЕННИКА,"В Бразилии, взрослые тоже должны прививаться регулярно?",Нет,Только в чрезвычайных ситуациях,Да
299,ВАКЦИНАЦИЯ ПУТЕШЕСТВЕННИКА,Прививка против желтой лихорадки перед поездкой:,Это не является необходимым,Зависит от возраста,Это не является необходимым
300,ВАКЦИНАЦИЯ ПУТЕШЕСТВЕННИКА,На каких сайтах можно получить полную и достоверную информацию о прививках?,"Национальное Агентство по Санитарному Надзору, ANVISA",Министерство Здравоохранения,Все варианты
301,НАДЗОР ЗА НАЗЕЛЕНИЕМ ПОДВЕРЖЕННЫМ ВОЗДЕЙСТВИЮ ХИМИЧЕСКИХ ЗАГРЯЗНЯЮЩИХ ВЕЩЕСТВ ,Что делать в случае отравления химическими загрязнителями?,Вызвать рвоту,Пить молоко,Искать врача
302,НАДЗОР ЗА НАЗЕЛЕНИЕМ ПОДВЕРЖЕННЫМ ВОЗДЕЙСТВИЮ ХИМИЧЕСКИХ ЗАГРЯЗНЯЮЩИХ ВЕЩЕСТВ ,Что делать в случае отравления пестицидами?,Вызвать рвоту,Пить молоко,Искать врача