ID,ТЕМА,ВОПРОС,АЛЬТЕРНАТИВА А,АЛЬТЕРНАТИВА B,АЛЬТЕРНАТИВА С
118,ПЯТНИСТАЯ ЛИХОРАДКА,Благоприятная среда для пятнистой лихорадки?,Районы с мусором,Области с комарами,Зоны с клещами 
119,ПЯТНИСТАЯ ЛИХОРАДКА,Какие из них являются симптомами пятнистой лихорадки?,Диарея,Рвота,Жар
120,ПЯТНИСТАЯ ЛИХОРАДКА,"Если у вас появились симптомы пятнистой лихорадки, что вы должны сделать?",Переждать,Пить жидкость,Искать врача
121,ПЯТНИСТАЯ ЛИХОРАДКА,Какие профилактические меры пятнистой лихорадки вы можете провести в вашем доме?,Убрать застоявшуюся воду ,Мыть туалеты ,Прибирать дворы
122,ЛИМФАТИЧЕСКИЙ ФИЛЯРИОЗ,"Что собой представляет комар Culex, который передает лимфатический филяриоз?",Малярийные комары,Aedes aegypti,Настоящие комары quinquefasciatus
123,ЛИМФАТИЧЕСКИЙ ФИЛЯРИОЗ,Это осложнение лимфатического филяриоза:,Желудочно-кишечное кровотечение,Слепота,Элефантиаз
124,ЛИМФАТИЧЕСКИЙ ФИЛЯРИОЗ,Лимфатический филяриоз это инфекция?,Вирусный,Бактериальные,Паразитический
125,БОЛЕЗНЬ ХАНСЕНА (ЛЕПРА),Что такое болезнь Хансена (Лепра)?,Вирус,Простейшее,Болезнь
126,БОЛЕЗНЬ ХАНСЕНА (ЛЕПРА),"Пациенту болеющему лепрой необходимо использовать отдельные стаканы, чашки, столовые приборы и посуду?",Да,Только тарелки,Нет
127,БОЛЕЗНЬ ХАНСЕНА (ЛЕПРА),Как можно заболеть лепрой,Рукопожатие,Половые отношения,Контакт с болеющим
128,ГРИПП,Наиболее важный симптом гриппа?,Рвота,Мышечные боли,Сильный жар
129,ГРИПП,Какое заболевание часто путают с гриппом?,Гайморит,Эзофагита,простуда
130,ГРИПП,Частое мытье и гигиена рук может предотвратить грипп?,Нет,Сразу после еды,Да
131,ГРИПП,"Избегать близкого контакта с людьми у которых явные признаки или симптомы гриппа, поможет не заразиться?",Нет,От 1 м,Да
132,ГРИПП,"Прикрывать нос и рот при чихании или кашле, уменьшает заражение  гриппом?",Нет ,Только закрывать рот ,Да
133,ГРИПП,Б Бразилии есть прививка против гриппа?,Нет,Только для H1N1,Да
134,ГРИПП,Беременные женщины могут сделать прививку от гриппа?,Нет,"Да, после 3 месяцев",Да
135,ГРИПП,Грипп в Бразилии может циркулировать в течение всего года?,Только в на юго востоке,Нет,Да
136,ГРИПП,Заключенные могут сделать прививку против гриппа?,Нет,> 5 лет лишения свободы,Да
137,ГРИПП,"Носители неинфекционных хронических заболеваний, могут сделать прививку от гриппа?",Нет,Только сердечно-сосудистые заболевания,Да
138,ГУСЕНИЦА,"Как называется гусеница в Бразилии, заражение от которой вызывает кровотечение?",Automeris,Павлиноглазка,Гусеница  Lonomia
139,ГУСЕНИЦА,Как можно отравиться гусеницей?,Через укус,Прокушенная кожа,Контакт с щетинками
140,ГУСЕНИЦА,Какое из этих мероприятий приведет к повышению рисков столкновения с гусеницей рода Lonomia?,Лежать на траве,Бегать по траве,Лазить по деревьям
141,ПОДКОЖНЫЙ ЛЕЙШМАНИОЗ,Что такое подкожный лейшманиоз?,Редкое заболевание,Хроническая болезнь,Инфекционные заболевания
142,ПОДКОЖНЫЙ ЛЕЙШМАНИОЗ,Как охарактеризовать типичную язву подкожного лейшманиоза?,Болезненные,Болезненно на коже,Безболезненно
143,ПОДКОЖНЫЙ ЛЕЙШМАНИОЗ,Что подтверждается диагноз подкожного лейшманиоза?,Серология,Клинический,Паразитологическое
144,ПОДКОЖНЫЙ ЛЕЙШМАНИОЗ,"В каких зонах, как правило, может произойти заражение подкожным лейшманиозом?",Урбанизирована,Прибрежные,Лесной и сельский
145,ПОДКОЖНЫЙ ЛЕЙШМАНИОЗ,Какой из этих насекомых передаёт подкожный лейшманиоз?,Aedes aegypti,Парикмахеры,Комар Маруйн
146,ПОДКОЖНЫЙ ЛЕЙШМАНИОЗ,Где развивается вектор подкожного лейшманиоза?,Стоячая вода,Затопленные деревянные дома,Влажные места
147,ПОДКОЖНЫЙ ЛЕЙШМАНИОЗ,Какой из них не является способом профилактики подкожного лейшманиоза?,Поддерживать чистоту во дворе,Использовать репелленты ,Убрать застоявшуюся воду 
148,ВИСЦЕРАЛЬНЫЙ ЛЕЙШМАНИОЗ,Под каким именем широко известен висцеральный лейшманиоз?,Сюрприз с Востока,Кожные мигрирующая личинка,Язва
149,ВИСЦЕРАЛЬНЫЙ ЛЕЙШМАНИОЗ,В каком регионе Бразилии наибольшее количество случаев висцерального лейшманиоза?,Южный регион,Северный регион,Северный регион
150,ВИСЦЕРАЛЬНЫЙ ЛЕЙШМАНИОЗ,"Если не лечить висцеральный лейшманиоз, это может привести к смерти?",Нет,Только в пожилом возрасте,Да
151,ВИСЦЕРАЛЬНЫЙ ЛЕЙШМАНИОЗ,Какой из них является симптомом висцерального лейшманиоза?,Слепота,Обезвоживание,Жар
152,ВИСЦЕРАЛЬНЫЙ ЛЕЙШМАНИОЗ,Есть ли лечение висцерального лейшманиоза?,Нет,Только частная сеть,"Да, в Единой Системе Здравоохранения"
153,ВИСЦЕРАЛЬНЫЙ ЛЕЙШМАНИОЗ,"Какой анализ можно сделать в Единой Системе Здравоохранения, для диагностики висцерального лейшманиоза?",Анализ крови,Ультразвуковое исследование,Быстрый тест
154,ВИСЦЕРАЛЬНЫЙ ЛЕЙШМАНИОЗ,Что является основным резервуаром лейшманиоза в городских районах?,Курица,Человек,Собака
155,ВИСЦЕРАЛЬНЫЙ ЛЕЙШМАНИОЗ,Основная форма передачи висцерального лейшманиоза среди собак?,Укус,Контакт с мочой,Укусы насекомых
156,ВИСЦЕРАЛЬНЫЙ ЛЕЙШМАНИОЗ,Какой из них является одним из основных клинических признаков висцерального лейшманиоза у собак?,Агрессия,Пожелтение кожи,Поражения кожи
157,ВИСЦЕРАЛЬНЫЙ ЛЕЙШМАНИОЗ,Какое из этих насекомых передает висцеральный лейшманиоз людям?,Aedes aegypti,Парикмахеры,Комар Маруйн
158,ВИСЦЕРАЛЬНЫЙ ЛЕЙШМАНИОЗ,"Где развивается насекомое, которое передает висцеральный лейшманиоз?",Стоячая вода,Затопленные деревянные дома,Влажные места
159,МАЛЯРИЯ,В этом регионе Бразилии сосредоточено более 99% случаев малярии?,Юго-Восток,Северо-Восток,Север
160,МАЛЯРИЯ,Так передаётся малярия?,Через воду,Через продукты питания,Укус комара
161,МАЛЯРИЯ,"В каком из этих мест находятся личинки комаров, которые являются переносчиками малярии?",Резервуары для воды,В колодцах,В озёрах
162,МАЛЯРИЯ,"Какой из этих путей является правильным, для того, чтобы защитить себя от малярийного комара?",Принимая витамины,Сделать прививку,Используйте противомоскитные сетки
163,МАЛЯРИЯ,Какой комар передает малярию?,Самка  Aedes,Самец Anopheles,Самка Anopheles
164,МАЛЯРИЯ,Какие из них являются симптомами тяжелой малярии:,Изнеможение,Кровотечения,Сильный жар >41°C
165,МАЛЯРИЯ,Наиболее подходящие средства для прерывания цикла передачи малярии?,Чай и постельный режим,Это невозможно,Своевременный диагноз
166,МАЛЯРИЯ,Самый распространённый симптомом малярии?,Одышка,Пятна на коже,Сильный жар
167,МАЛЯРИЯ,Существуют лекарства для профилактики малярии?,Нет,Только импортные,Да
168,МАЛЯРИЯ,Кто может заразиться малярией?,Только мужчины,Только дети,Любой человек
169,МАЛЯРИЯ,Каковы наиболее распространенные признаки и симптомы малярии?,Пятна на коже,Боли в суставах,Жар
170,МАЛЯРИЯ,Могу ли я заразиться малярией более чем один раз?,Нет,"Да, дважды",Да
171,МАЛЯРИЯ,Существует ли вакцина от малярии?,Да,Только для взрослых,Нет
172,МАЛЯРИЯ,Как поставить диагноз малярии?,Через слюну,Ликёр,Через кровь
173,МАЛЯРИЯ,Существует ли тяжёлая форма малярии?,Нет,Всегда тяжёлая форма,Да
174,МАЛЯРИЯ,Где находится эндемичная малярия в Бразилии?,Юго-Восток,Северо-Восток,Север
175,МАЛЯРИЯ,Что вызывает малярию?,Вирус,Бактерия,Плазмодий
176,МАЛЯРИЯ,Могу ли я заразиться малярией от другого человека?,"Да, охватывая","Да, через поцелуй",Нет
177,МАЛЯРИЯ,Где я могу сдать анализы на малярию?,Аптека,Сосед,Единая Система Здравоохранения
178,МАЛЯРИЯ,Где лечат малярия?,В аптеке,У соседа,В Единой Системе Здравоохранения
179,МАЛЯРИЯ,Сколько стоит лечение малярии?,300 реалов,50 реалов,Бесплатно в Единой Системе Здравоохранения
180,МАЛЯРИЯ,Существует малярия в Бразилии?,"Нет, только в Азии","Нет, только в Африке",Да
181,МАЛЯРИЯ,На каком из этих континентов есть случаи малярии?,Америка и Океания,Азия и Океания,Америка и Африка
182,МАЛЯРИЯ,Как избежать заражения малярией?,Укус комара,Переливание крови,Загрязнённая вода
183,МАЛЯРИЯ,Единое ли лечение для наиболее распространенных видов малярии в Бразилии (трехдневная и фальципарум)?,Да,Нет лечения,Нет
184,МАЛЯРИЯ,Жар - симптом малярии?,Нет,Только невысокая температура,Да
185,МАЛЯРИЯ,"Комар, передающий денге, также передает малярию?",Да,Все болезни,Нет
186,МАЛЯРИЯ,"В этом органе размножается паразит малярии, прежде чем атаковать красные клетки крови?",Кожа,Селезенка,Печень
187,МАЛЯРИЯ,"Наиболее благоприятный сезон для укуса комара, который передает малярию?",В течение дня,Когда идет дождь,"Утром, днем и вечером"
188,МАЛЯРИЯ,Малярия может убить?,Только оставляет осложнения,Нет,Да
189,МАЛЯРИЯ,Беременные женщины с малярией могут нормально принимать лекарства?,Да,Смотря какой случай,Нет
190,МАЛЯРИЯ,Могу ли я вылечить малярию чаями и растениями?,Да,Только чаем,Нет
191,МАЛЯРИЯ,Должен ли я избегать употреблять какие-либо продукты питания из-за лекарств от малярии?,Острая пища,Жирная пища,Нет
192,МАЛЯРИЯ,Кто является носителями паразита малярии в его жизненном цикле?,Только человека,Никакой,Комар и человек
193,МАЛЯРИЯ,Какой процент населения мира находится под угрозой малярии?,0%,10%,50%
194,МАЛЯРИЯ,"Как быстро, после укуса зараженного комара, человек начинает испытывать симптомы малярии?",1 - 3 дня,30 дней,10 - 15 дней
195,МАЛЯРИЯ,Любой комар является переносчиком малярии?,Да,"Нет, только Aedes","Нет, только Anopheles"
196,МАЛЯРИЯ,Так передаётся малярия?,Через обнимание,Через поцелуй,Укус комара
197,МАЛЯРИЯ,Что можно сделать для профилактики малярии?,Есть фрукты,Пить чай,Избегать комаров
198,МАЛЯРИЯ,Малярия излечима?,В некоторых случаях,Нет,Да
199,МАЛЯРИЯ,Где я могу сделать прививку от малярии?,В частной больнице,Аптеки,Нет прививки
200,МАЛЯРИЯ,Существует специальный репеллент для борьбы с малярийным комаром?,Да,"Да, импортные",Нет
201,МАЛЯРИЯ,Малярийный комар размножается как комар денге?,Да,Не размножается,Нет
202,МАЛЯРИЯ,Какой комар anopheles передает малярию? Самец или самка?,Оба,Только самец,Только самка 
203,МАЛЯРИЯ,"Если беременная женщина болеет малярией, жизнь ребенка находится под угрозой?",Только мать подвергается риску,Нет,Да
204,МАЛЯРИЯ,Для какого возраста малярия может быть более опасной?,Подростки,Взрослые,Пожилых людей и детей
205,МАЛЯРИЯ,Рекомендуется ли проводить лечение малярии до конца?,Нет,"Нет, только половину",Да
206,ЛЕКАРСТВА,"Какой тип препаратов, используется для лечения бактериальных инфекций?",Противорвотные средства,Противовирусные препараты,Антибиотики
207,ЛЕКАРСТВА,"Какая тип препаратов, используется для лечения боли?",Антациды,Противоопухолевые средства,Анальгетики
208,ЛЕКАРСТВА,"Какой тип препаратов, используется для лечения рака?",Препараты противоязвенные,Спазмолитик,Противоопухолевые препараты
209,ЛЕКАРСТВА,Где можно найти самую важную информацию о продукте?,Рецепт,Первичная упаковка,Инструкция к применению
210,ЛЕКАРСТВА,"Любой уход, используемый для лечения или облегчения симптомов болезни называется:",Плацебо,Прививка,Препараты 
211,ЛЕКАРСТВА,"Лекарства, полученные непосредственно из растительного экстракта называются:",Настои и чаи,Гомеопатические,Фитотерапия
212,МЕНИНГИТ,Какой из этих признаков и симптомов проявляются при менингите?,Рвота,Кашель,Ригидность затылочных мышц
213,МЕНИНГИТ,Какое заболевание приводит к воспалению мозговых оболочек?,Инсульт,Тромбоз,Менингит
214,МЕНИНГИТ,Наиболее серьезный тип менингита вызван каким микроорганизм?,Вирус,Грибки,Бактерии
215,МИКРОЦЕФАЛИЯ,Что такое микроцефалия?,Бактерия,Вирус,Неправильное формирование плода
216,ОНХОЦЕРКОЗ,какой комар передает онхоцеркоз?,Aedes aegypti,Настоящие комары,Мошки Simulium
217,ОНХОЦЕРКОЗ,Под каким названием также известна болезнь онхоцеркоз?,Улиточная лихорадка,Заболевания передающиеся клещами,Речная слепота
218,ОНХОЦЕРКОЗ,В каких федеративных округах Бразилии зафиксированы случаи онхоцеркоза?,Санта-Катарина и Рио-Гранде-ду-Сул,Гояс и Мату-Гросу,Амазонас и Рорайма
219,ДРУГИЕ ЯДОВИТЫЕ ЖИВОТНЫЕ,Что делать если произошёл несчастный случай с ядовитыми животными?,Бегать и прыгать,Пить чай,Искать врача
220,ДРУГИЕ ЯДОВИТЫЕ ЖИВОТНЫЕ,Какой из этих животных считается ядовитым?,Крыса,Летучая мышь hematófago,Банановый паук
221,ДРУГИЕ ЯДОВИТЫЕ ЖИВОТНЫЕ,Какой из этих животных считается ядовитым?,Собака,Рыба Баяку,Скорпион
222,ДРУГИЕ ЯДОВИТЫЕ ЖИВОТНЫЕ,Какой из этих животных считается ядовитым?,Ящерица ,Рыба Меч ,Кобра Жарарака
223,ДРУГИЕ ЯДОВИТЫЕ ЖИВОТНЫЕ,Какой из этих животных считается ядовитым?,Веретеница ломкая,Ложный скорпион,Многоножки
224,ДРУГИЕ ЯДОВИТЫЕ ЖИВОТНЫЕ,Какой из этих животных считается ядовитым?,Слепая змея,Акула,Медуза
225,ПОЛИОМИЕЛИТ,Каким микроорганизмом вызывается полиомиелит?,Бактерия,Грибки,Вирус
226,ПОЛИОМИЕЛИТ,Под каким названием широко известен полиомиелит?,Круп,Затяжной кашель,Детский паралич
227,ПОЛИОМИЕЛИТ,"В общем, каков инкубационный период полиомиелита?",1 - 6 дней,5-15 дней,7 - 12 дней
228,ПОЛИОМИЕЛИТ,Главная профилактическая мера против полиомиелита?,Антибиотикотерапия,Использование презервативов,Вакцинация
229,ПОЛИОМИЕЛИТ,Какое заболевание подозревается у ребёнка младше 15 лет с острым вялым параличом?,Столбняк,Коклюш,Полиомиелит
230,БЕШЕНСТВО ,Как заражаются бешенством?,Комары,Птицы,Млекопитающие
231,БЕШЕНСТВО ,Какие из этих примеров являются передатчиками бешенства?,Кролик и Хомяк,Курица и утка,Собаки и кошки
232,БЕШЕНСТВО ,Какой из этих вариантов является методом передачи бешенства?,Контакт с мусором,Укус комара,Укус
233,БЕШЕНСТВО ,Какие из этих причин являются симптомами бешенства у людей?,Красные пятна на теле,Диарея,Подергивание мышц
234,БЕШЕНСТВО ,Каковы основные признаки и симптомы бешенства у животного (собаки или кошки)?,Виляет хвостом,Становится ручным,Отсутствие аппетита
235,БЕШЕНСТВО ,Как предотвратить бешенство?,Не выходите из дома,Избегайте свалок,Собаки и кошки
236,БЕШЕНСТВО ,"Излечим ли человек, который болен бешенством?",Да,Иногда,"Нет лечения, убивает! "
237,ДЕЗИНФЕКЦИЯ,Продукты для очистки неживых поверхностей:,Косметика,Антиоксиданты,Дезинфекция
238,ДЕЗИНФЕКЦИЯ,"При нечаянном приёме внутрь или с воздухом чистящего средства, необходимо всегда:",Вызывает рвоту,Пить воду,Читайте этикетку
239,КОРЬ,"Корь - заразное инфекционное заболевание, вызываемое?",Бактерия,Простейшие,Вирус
240,КОРЬ,Передача вируса кори происходит путем:,Орально или фекально ,Aedes aegypti,Дыхательные пути
241,КОРЬ,"Какой из этих вариантов, является характерным признаком кори?",Конъюнктивит,Головная боль,Красные пятна 
242,КОРЬ,Каков приблизительный период инкубации кори?,5 дней,3 дня,10 дней
243,КОРЬ,Наиболее эффективный способ профилактики кори?,Использование СИЗ,Изоляция,Прививка
244,КОРЬ,Что является критерием для подтверждения случая заболевания кори?,Биопсия,Диагностическое Сканирование,Лабораторные анализы
245,КОРЬ,"Идеальный период, чтобы уведомить о подозреваемом случае кори?",До 48 часов,До 72 часов,До 24 часов
